{
  "$schema": "https://json-schema.org/draft/2020-12/schema",
  "$id": "https://babyrush0101-source.github.io/mapsoo-kids/schemas/mapsoo-world-asset-receipt-0.1.schema.json",
  "title": "Mapsoo World Asset Receipt 0.1",
  "type": "object",
  "additionalProperties": false,
  "required": ["schema_version", "completed_at", "request", "provider", "output", "disclosures"],
  "properties": {
    "schema_version": { "const": "0.1.0" },
    "completed_at": { "type": "string", "format": "date-time" },
    "request": {
      "type": "object",
      "additionalProperties": false,
      "required": ["fingerprint_sha256", "profile", "seed", "reference_rights"],
      "properties": {
        "fingerprint_sha256": { "$ref": "#/$defs/sha256" },
        "profile": { "const": "topdown-farm" },
        "seed": { "type": "string", "minLength": 1, "maxLength": 160 },
        "reference_rights": {
          "type": "array",
          "minItems": 2,
          "maxItems": 2,
          "prefixItems": [
            { "$ref": "#/$defs/referenceRights" },
            { "$ref": "#/$defs/referenceRights" }
          ],
          "items": false,
          "allOf": [
            {
              "contains": { "type": "object", "properties": { "role": { "const": "environment-style" } }, "required": ["role"] },
              "minContains": 1,
              "maxContains": 1
            },
            {
              "contains": { "type": "object", "properties": { "role": { "const": "character" } }, "required": ["role"] },
              "minContains": 1,
              "maxContains": 1
            }
          ]
        }
      }
    },
    "provider": {
      "type": "object",
      "additionalProperties": false,
      "required": ["id", "version", "execution", "determinism", "output_provenance"],
      "properties": {
        "id": { "type": "string", "minLength": 1, "maxLength": 80 },
        "version": { "type": "string", "minLength": 1, "maxLength": 80 },
        "execution": { "enum": ["local", "remote"] },
        "determinism": { "enum": ["seeded", "best-effort", "replay"] },
        "output_provenance": { "enum": ["procedural", "generative-ai", "recorded-replay"] }
      }
    },
    "output": {
      "type": "object",
      "additionalProperties": false,
      "required": ["completeness_policy", "license", "files"],
      "properties": {
        "completeness_policy": { "const": "topdown-farm-complete-v1" },
        "license": { "const": "CC0-1.0" },
        "files": {
          "type": "array",
          "minItems": 1,
          "items": {
            "type": "object",
            "additionalProperties": false,
            "required": ["path", "bytes", "sha256"],
            "properties": {
              "path": { "$ref": "#/$defs/safePath" },
              "bytes": { "type": "integer", "minimum": 1 },
              "sha256": { "$ref": "#/$defs/sha256" }
            }
          }
        }
      }
    },
    "disclosures": {
      "type": "array",
      "minItems": 3,
      "maxItems": 3,
      "items": { "type": "string", "minLength": 1, "maxLength": 500 }
    }
  },
  "$defs": {
    "sha256": { "type": "string", "pattern": "^[a-f0-9]{64}$" },
    "safePath": {
      "type": "string",
      "maxLength": 240,
      "pattern": "^[a-z0-9][a-z0-9._-]*(?:/[a-z0-9][a-z0-9._-]*)*$"
    },
    "referenceRights": {
      "type": "object",
      "additionalProperties": false,
      "required": ["role", "basis", "license", "permits_cc0_dedication"],
      "properties": {
        "role": { "enum": ["environment-style", "character"] },
        "basis": { "const": "owned" },
        "license": { "const": "LicenseRef-User-Owned" },
        "permits_cc0_dedication": { "const": true }
      }
    }
  }
}
